"from_node";"to_node";"label";"title";"roleCount";"is_same_level"
imp_12;imp_31;;Sea Level Rise can trigger Saltwater Intrusion by introducing seawater to freshwater aquifers, degrading water quality and making it unusable for drinking and aquaculture (175);1;1
imp_13;imp_23;;Sea Ice and Glaciers melting can disrupt ocean circulation patterns, potentially contributing to changes in weather systems and increasing the frequency or intensity of extreme Natural Disasters such as storms and hurricanes (182);1;1
imp_13;imp_29;;Increases in Natural Disasters pose a major risk to Human Life, particularly in vulnerable regions with limited resources and low adaptive capacity;1;1
imp_15;imp_16;;Harmful Algal Blooms can create Hypoxia and Dead Zones when decaying algae consume dissolved oxygen in the water. (145);1;1
imp_15;imp_17;;Algal Blooms may include or promote toxin-producing species, but not all blooms develop into Harmful Algal Blooms. (145);1;1
imp_15;imp_18;;Harmful Algal Blooms, often involving toxin-producing cyanobacteria in freshwater or dinoflagellates in marine environments, release toxins that are lethal to aquatic life, and prolonged or frequent events can result in Marine Biodiversity Loss (146);1;1
imp_16;imp_17;;"Algal Blooms are a major driver of Hypoxia; when algae die and decompose, oxygen levels drop, forming Dead Zones. (145)";1;1
imp_16;imp_18;;Hypoxia/Dead Zones directly cause mortality of aquatic life, threatening Biodiversity as low-oxygen conditions cannot support most fish and invertebrates (146);1;1
imp_17;imp_18;;Even non-toxic Algal Blooms can block sunlight, damage fish gills, and disrupt aquatic ecosystems, causing mortality of aquatic species and threatening Marine Biodiversity (145);1;1
imp_18;imp_35;;Coral Bleaching can lead to Reef Degradation, disrupting entire reef ecosystems, increasing mortality among marine organisms, and contributing to Biodiversity Loss (184);1;1
imp_18;imp_36;;Marine Heatwaves impose thermal stress on marine organisms, driving mortality of aquatic life, reducing species’ resilience and recovery capacity, and resulting in Biodiversity Loss (185);1;1
imp_2;imp_11;;Ecosystem Degradation or Collapse affects Agriculture by reducing populations of natural pollinators and increasing the prevalence of pests and diseases, ultimately reducing Agricultural Yields (186);1;1
imp_2;imp_13;;The Degradation or Collapse of major Ecosystems, such as the Amazon rainforest and the Great Barrier Reef, can disrupt the water cycle and weaken natural buffering systems against extreme events, altering Weather Patterns and increasing vulnerability to Natural Disasters such as severe Flooding, Storm Surges, and accelerated Erosion (187);1;1
imp_2;imp_15;;Toxins from Harmful Algal Blooms can poison wildlife and deplete oxygen in surrounding waters, destabilizing ecosystems and contributing to Ecosystem Degradation. (145);1;1
imp_2;imp_21;;Heatwaves can lead to Ecosystem Degradation or Collapse by disrupting vegetation and wildlife: extreme heat reduces plant photosynthesis and water balance, lowers food quality, increases reproductive failure, and raises mortality rates, ultimately weakening ecosystem stability (173);1;1
imp_2;imp_3;;Ecosystem Degradation or Collapse drives Species Extinction by progressively destroying and fragmenting habitats, reducing population sizes, disrupting ecological interactions, and ultimately leaving species unable to survive or reproduce (143, 187);1;1
imp_2;imp_32;;Water Scarcity is a major driver of Biodiversity Loss and the disappearance of Wetlands, undermining ecological resilience and leading to the loss and degradation of Ecosystems and their services (180);1;1
imp_2;imp_35;;Mass Coral Bleaching has already affected a large share of the world’s coral reefs, and with continuously rising Ocean Temperatures, corals are increasingly unable to recover to their healthy state—pushing reef ecosystems toward widespread degradation and potential collapse (185);1;1
imp_2;imp_5;;Ecosystem Degradation or Collapse can trigger cascading impacts on ecosystem goods and services, including reduced agricultural productivity, increased disease risk, and heightened exposure to natural disasters, thereby threatening Agriculture and Food Security (186);1;1
imp_21;imp_23;;Melting Glaciers, Ice, and Snow reduce the Earth’s ability to reflect solar radiation (albedo), leading to increased heat absorption and contributing to more intense heatwaves worldwide (183);1;1
imp_21;imp_28;;Heatwaves increase the risk of Bushfires and Wildfires, leading to Human Displacement, Habitat Destruction, and Air Pollution (173, 174);1;1
imp_21;imp_29;;Heatwaves are a leading cause of weather-related deaths, as extreme heat can trigger heatstroke and worsen pre-existing conditions, particularly among people with chronic diseases, older adults, and children (171);1;1
imp_21;imp_30;;Heatwaves can indirectly lead to Human Displacement through cascading impacts, where extreme heat intensifies hazards such as Droughts, Wildfires, and Floods, which in turn force populations to relocate (173);1;1
imp_21;imp_36;;Atmospheric Heatwaves can trigger and intensify Marine Heatwaves, where prolonged hot, low-wind conditions over the ocean reduce heat dissipation and increase sea surface temperatures over large areas (185);1;1
imp_23;imp_30;;Melting Ice, Glaciers, and Snow can threaten Arctic communities that depend on ecosystem services for their livelihoods, potentially forcing displacement as their local environment and habitats degrade or disappear (183);1;1
imp_23;imp_32;;Melting Glaciers lead to Water Shortages/Scarcity by reducing natural freshwater storage, causing a short-term surplus followed by long-term declines in water availability in rivers and lakes during dry periods (193);1;1
imp_23;imp_33;;Melting Ice can alter Global Shipping Routes both positively and negatively by opening new routes in the Arctic while also disrupting existing routes, presenting challenges for global logistics (183);1;1
imp_23;imp_34;;Melting Ice and Glaciers can force wild animals to move closer to human settlements in search of food and suitable habitat, often resulting in more frequent Human-Wildlife Conflicts (183);1;1
imp_25;imp_28;;Droughts can trigger Wildfires as vegetation becomes drier and more flammable, increasing the likelihood of ignition and enabling fires to spread more easily;1;1
imp_25;imp_30;;Droughts are contributing to increasing Human Displacement, often within countries. This can strain local resources and exacerbate existing conflicts (179);1;1
imp_25;imp_32;;Prolonged droughts can lead to Water Scarcity, directly threatening the health, safety, and welfare of communities (177);1;1
imp_26;imp_29;;Floods pose a significant risk to Human Life by causing injuries and fatalities through drowning and structural collapse (176);1;1
imp_26;imp_30;;Flooding can lead to temporary or permanent Human Displacement, creating challenges such as Overcrowding, Social Inequalities, and Civil Unrest (176);1;1
imp_28;imp_29;;Wildfires and Bushfires can threaten Human Lives by releasing toxic smoke and particulate matter that exacerbate respiratory and cardiovascular diseases, potentially leading to premature death (198);1;1
imp_3;imp_18;;Species Extinction drives Biodiversity Loss and threatens entire Ecosystems. Over the past 500 years, 20–24 marine extinctions have been recorded, while widespread declines in marine populations may accelerate future extinctions and increase the risk of ecosystem degradation (203);1;1
imp_3;imp_21;;Heatwaves with increased frequency are particularly harmful to marine life, as repeated thermal stress disrupts ecosystems, causes mass mortality events, and increases the risk of Species Extinction (173);1;1
imp_35;imp_36;;Marine Heatwaves are responsible for Mass Coral Bleaching and significant declines in kelp forests and seagrass meadows, threatening the goods and services provided by these ecosystems (185);1;1
imp_4;imp_10;;Unsafe Drinking Water can cause short- and long-term health effects, ranging from gastrointestinal illness to cancer, depending on the contaminants. Chemical Exposure may lead to skin conditions, nervous system or organ damage, developmental or reproductive disorders, and cancer, while Microbial Contamination can spread diseases such as cholera, typhoid, hepatitis, and severe diarrheal illness. (142);1;1
imp_4;imp_15;;Harmful Algal Blooms (HABs) can affect human health through inhalation of toxin-containing aerosols released by certain algal species. (143);1;1
imp_4;imp_21;;Heatwaves increase the risk of heat stroke, severe dehydration, and acute cerebrovascular events, while also contributing to blood clot formation (171);1;1
imp_4;imp_25;;Droughts directly impact Human Health by reducing water quantity and quality, increasing the incidence of illness and disease, raising mortality rates, and contributing to mental health issues (177);1;1
imp_4;imp_26;;Floods can impact Human Health physically by increasing the risk of waterborne diseases from contaminated water supplies, and mentally by contributing to stress-related conditions such as anxiety, depression, and post-traumatic stress disorder (PTSD) (175);1;1
imp_4;imp_28;;Wildfires produce harmful smoke, gases, and particulate matter that can cause fatalities and affect Human Health, ranging from eye and respiratory tract irritation to more serious conditions such as lung dysfunction, bronchitis, asthma, and premature death, particularly among vulnerable groups (181);1;1
imp_4;imp_32;;Lack of Water can lead to poor sanitation, which increases the risk of water-borne diseases such as diarrhea, cholera, and typhoid fever (180);1;1
imp_4;imp_5;;Food Insecurity directly impacts Human Health by limiting access to adequate nutrition, increasing the risk of chronic diseases such as diabetes and heart disease, and contributing to mental health disorders (196);1;1
imp_5;imp_11;;Reduced Agricultural Yields threaten Food Security, especially in vulnerable communities, as falling yields disrupt supply chains and inflate prices (178);1;1
imp_5;imp_19;;Food Production Shortages can lead to Food Insecurity when they are prolonged or severe;1;1
imp_5;imp_21;;Heatwaves can lead to Food Insecurity by disrupting food systems across Livestock Farming, Aquaculture, and Crop Farming, reducing yields, harming animal and plant health, degrading food quality, and shortening shelf life (173, 174);1;1
imp_5;imp_29;;Food Insecurity threatens Human Lives through acute starvation, severe malnutrition, and increased vulnerability to otherwise preventable diseases. The latest SOFI report estimates 673 million people experienced hunger in 2024, while the WFP reports 319 million people facing acute food insecurity across at least 67 countries in 2025 (197);1;1
imp_6;imp_11;;Reduced Agricultural Yields can trigger Economic Decline with increases in input costs, lost revenues, and localised Food Insecurity (178);1;1
imp_6;imp_19;;Food Production Shortages drive Economic Decline by creating supply shocks that reduce output, increase inflationary pressure, disrupt supply chains, lower purchasing power, raise labour costs, reduce profitability, and increase malnutrition (160);1;1
imp_6;imp_21;;"Heatwaves can impact the economy by increasing living costs as demand for healthcare, energy, water, and food rises; raising infrastructure costs for operation, maintenance, repair, and replacement; and reducing labour productivity and availability due to effects on worker health and well-being (173)";1;1
imp_6;imp_23;;Melting Glaciers and Snow can negatively impact mountain communities that depend on glacier- and snow-based tourism, resulting in significant Economic Losses and reducing the livelihoods of many people (193);1;1
imp_6;imp_26;;Floods affect both low and high-income countries, damaging infrastructure such as bridges, sewage systems, and power plants, resulting in significant Economic Decline (175, 176);1;1
imp_6;imp_28;;Wildfires and Bushfires can destroy large numbers of buildings, homes, and essential infrastructure, leading to significant Economic Losses and Decline (181);1;1
ind_1;con_1;Associates with;Excessive nitrogen and phosphorus fertilizers applied to boost yields in Corn Farming result in nutrient imbalances and runoff risks. (119);1;0
ind_1;con_2;Associates with;Intensive application of herbicides like atrazine and sulfonylureas in Corn Farming leads to persistent residues in soil, affecting crop rotation and non-target organisms. (118);1;0
ind_1;con_3;Associates with;Corn is one of the most widely grown crops globally, with about 33% of production occurring in highly water-stressed areas, raising concerns about water supply and long-term sustainability. (148);1;0
ind_1;con_4;Associates with;Tillage and monocropping in Corn Farming erode topsoil and deplete organic matter, harming soil structure. (120);1;0
ind_1;con_5;Contributes to;Rising global demand for Corn, primarily fueled by the Livestock and Ethanol industries, is driving land expansion, which often leads to Deforestation, especially in Brazil, one of the world's largest Corn Producers. (123);1;0
ind_1;con_6;Associates with;Corn Farming is often practiced as a monoculture, especially in large-scale, industrialized agriculture. ();1;0
ind_10;ind_11;;Cattle Farming supplies live cattle to the Cattle Slaughtering industry, where animals are processed into meat and byproducts.;1;1
ind_10;ind_20;;Cattle Farming produces live Cattle that are traded domestically and internationally for Breeding or Slaughter.;1;1
ind_11;ind_22;;Rendering Plants process raw byproducts from Cattle Slaughtering—including Bones, Cartilage, Hides, Fat, Offal, Blood, Hooves, and Horns—into usable materials.;1;1
ind_17;ind_18;;Farmed Pigs are transported to Slaughtering facilities for killing and initial processing;1;1
ind_17;ind_21;;Pig Farming produces pigs that are widely traded for Breeding, Fattening, or Slaughter.;1;1
ind_18;ind_22;;Rendering Plants collect and process byproducts from Pig Slaughtering, such as Bones, Cartilage, Fat, Offal, and Blood, into industrial ingredients.;1;1
ind_22;ind_14;;The Animal Rendering Industry supplies prepared Animal Skins and Hides to the Tanning Industry for leather production.;1;1
ind_22;ind_23;;The Animal Rendering Industry supplies the Pharmaceuticals Industry with materials such as Collagen, Gelatin, Chondroitin Sulfate, Heparin, and Insulin, derived from Bovine, Porcine, and Avian byproducts.;1;1
ind_22;ind_25;;The Rendering Industry provides the Cosmetics Industry with ingredients including Animal Fats, Gelatin, Collagen, Keratin, Glycerin (Glycerol), and Stearic Acid, used as emollients, thickeners, and active components in personal care products.;1;1
ind_28;con_20;Causes;Broiler Poultry Farming faces similar risks from Highly Pathogenic Avian Influenza (HPAI) as the Layer Industry, but is relatively more resilient due to its shorter production cycles and faster turnover (157);1;0
ind_28;ind_29;;Poultry Farming produces birds traded domestically and internationally for Breeding, Egg Production, Fattening, or Slaughter.;1;1
ind_28;ind_30;;Farmed Avian species are supplied to the Poultry Slaughtering industry for killing and initial carcass processing.;1;1
ind_3;ind_4;;Crustacean Fisheries supply a major share of raw material to Crustacean Processing, contributing roughly 4–6 million tons of wild-caught crustaceans each year. (34);1;1
ind_3;ind_6;;"Shrimp and Prawn Farming supplies around 4 million tons of farmed shrimp annually; together, farmed and wild shrimp dominate Crustacean Processing volumes. (31, 34)";1;1
ind_3;ind_7;;Lobster Farming contributes a small but growing share of inputs to Crustacean Processing, remaining minor compared with wild catch. (36);1;1
ind_3;ind_8;;Crab Farming is an expanding aquaculture segment that provides a minor share of raw material for Crustacean Processing. (37);1;1
ind_3;ind_9;;Crayfish Farming supplies a small but growing portion of inputs to Crustacean Processing, with volumes well below Shrimp and Crab. (34);1;1
ind_30;ind_22;;Byproducts from Poultry Slaughtering are processed by the Rendering Industry into usable materials, though at much smaller volumes than Bovine or Porcine sources.;1;1
ind_30;ind_36;;Spent Layer Chickens are sent to slaughterhouses for processing into low-grade Meat Products and various Byproducts for downstream industries, or may be culled on site depending on operational practices.;1;1
ind_31;ind_32;;The Forestry Industry supplies Wood as the primary raw material for Paper Manufacturing.;1;1
ind_36;con_20;Causes;The Poultry Farming and Egg Production Industry faces significant risks from the rapid spread of Highly Pathogenic Avian Influenza (HPAI), introduced by migrating wild birds and exacerbated by high-density farming, inadequate biosecurity, and viral adaptation within local wild bird populations (157);1;0
ind_36;ind_37;;The Egg Breaking Industry is a high-speed sector of the Poultry/Egg Production Industry that processes Eggs into liquid, frozen, or dried egg products.;1;1
item_1;comp_1;Glucosamine: Main Ingredient in Joint Health Supplements. Health or nutritional benefits;Glucosamine is a primary ingredient in many Joint Health Supplements and is commonly used to support joint function and relieve joint discomfort.. Evidence: Moderate (23);1;0
item_1;comp_2;Chondroitin: Main Ingredient in Joint Health Supplements. Health or nutritional benefits;Chondroitin is frequently paired with Glucosamine in Joint Health Supplements to support cartilage health and joint comfort.. Evidence: Limited (28, 29);1;0
item_1;comp_4;Collagen (Type I, III): Active Ingredient in Joint Health Supplements. Health or nutritional benefits;Collagen is a key ingredient in Joint Health Supplements, believed to support cartilage health and improve joint flexibility. Evidence: Moderate (99, 100);1;0
item_1;comp_5;Marine Collagen (Type I): Active Ingredient in Joint Health Supplements. Health or nutritional benefits;Marine Collagen is commonly used in Joint Health Supplements for its small peptide size, which is thought to improve absorption and support cartilage health and joint mobility. Evidence: Moderate (99, 100);1;0
item_1;comp_6;MSM (Methylsulfonylmethane): Active Ingredient in Joint Health Supplements. Health or nutritional benefits;MSM (Methylsulfonylmethane) is used in Joint Health Supplements, where it is thought to support joint comfort, flexibility, and mobility.. Evidence: Moderate (109);1;0
item_1;comp_7;Hyaluronic Acid: Active Ingredient in Joint Health Supplements. Health or nutritional benefits;Hyaluronic Acid is used in Joint Health Supplements, where it is thought to support joint lubrication, cushioning, and overall mobility.. Evidence: Moderate (110);1;0
item_10;comp_3;Gelatin: Coating Agent in Confectionery (general). Provides Coating;Gelatin is commonly used in Confectionery to provide structure, chewiness, and stability.. Evidence: Not Applicable;1;0
item_11;comp_3;Gelatin: Excipient in Capsules. Controls Release;Gelatin is the primary material used in Capsules, forming a protective shell for powders, liquids, or supplements.. Evidence: Not Applicable;1;0
item_12;comp_4;Collagen (Type I, III): Main Ingredient in Collagen Peptides/Hydrolysed Collagen. Health or nutritional benefits;Collagen is the main ingredient in Collagen Peptides and Hydrolysed Collagen, providing short-chain proteins thought to support skin, hair, nails, and joint health. Evidence: Moderate (99, 100);1;0
item_12;comp_5;Marine Collagen (Type I): Main Ingredient in Collagen Peptides/Hydrolysed Collagen. Health or nutritional benefits;Marine Collagen is also included in Collagen Peptides and Hydrolysed Collagen products as a premium ingredient, used alongside Collagen from bovine or porcine sources. Its smaller peptide size is believed to make it more easily absorbed and support the health of skin, hair, nails, and joints.. Evidence: Moderate (99, 100);1;0
item_13;comp_4;Collagen (Type I, III): Active Ingredient in Collagen Face Cream. Health or nutritional benefits;Collagen is used in Collagen Face Creams, thought to help improve skin elasticity and hydration. Evidence: Moderate (102);1;0
item_13;comp_5;Marine Collagen (Type I): Active Ingredient in Collagen Face Cream. Health or nutritional benefits;Marine Collagen is also used in Collagen Face Creams as a higher-quality ingredient alongside Collagen from land-animal sources. Due to its smaller peptide size, it is thought to be more easily absorbed by the skin, helping enhance skin hydration and improve elasticity.. Evidence: Limited (102);1;0
item_14;comp_3;Gelatin: Biding Agent in Sausages. Enhances Stability;Gelatin is used in Sausages to improve binding, enhance juiciness, and create a firmer, more uniform texture by holding water and fat together during cooking.. Evidence: Not Applicable;1;0
item_14;comp_4;Collagen (Type I, III): Coating Agent in Sausages. Provides Coating;Collagen is used in Sausages, primarily as a casing material and structural component, helping maintain shape, bite, and overall texture during processing and cooking.. Evidence: Not Applicable;1;0
item_15;comp_11;Calcium Carbonate (CaCO3): Excipient in Tablets (Coated, Uncoated). Aids Manufacturing, Enhance Stability, Improve Drug Delivery and Patient Experience;Calcium Carbonate is widely used in the Pharmaceutical Industry as an inert filler, binder, and excipient in Tablets to buffer pH and support controlled drug delivery, as well as a bulking agent in Liquid Medicines, Ointments, and Creams.. Evidence: Industrially Established;1;0
item_15;comp_3;Gelatin: Coating Agent in Tablets (Coated, Uncoated). Provides Coating;Gelatin is used in Coated Tablets to form a smooth, protective outer layer that improves swallowability and helps control how the tablet dissolves in the body.. Evidence: Not Applicable;1;0
item_16;comp_3;Gelatin: Active Ingredient in Wound Dressings. Health or nutritional benefits;Gelatin is used in Wound Dressings to create a supportive, absorbent matrix that retains moisture, protects the wound surface, and supports the healing process.. Evidence: Not Applicable;1;0
item_16;comp_4;Collagen (Type I, III): Active Ingredient in Wound Dressings. Health or nutritional benefits;Collagen is used in Wound Dressings as a bioactive material thought to support tissue regeneration, promote cell growth, and assist the body’s natural wound-healing processes.. Evidence: Not Applicable;1;0
item_17;comp_1;Glucosamine: Active Ingredient in Pet Supplements. Health or nutritional benefits;Glucosamine is commonly used in Pet Supplements, where it is thought to support joint health, mobility, and comfort in dogs and other companion animals.. Evidence: Moderate (103, 105, 106);1;0
item_17;comp_2;Chondroitin: Active Ingredient in Pet Supplements. Health or nutritional benefits;Chondroitin is often included in Pet Supplements alongside Glucosamine, where it is thought to help maintain cartilage structure and support joint function.. Evidence: Limited (104, 105);1;0
item_17;comp_4;Collagen (Type I, III): Active Ingredient in Pet Supplements. Health or nutritional benefits;Collagen is used in Pet Supplements, where it is thought to support joint health, skin integrity, and coat condition by contributing to connective tissue structure.. Evidence: Moderate (106);1;0
item_18;comp_3;Gelatin: Gelling Agent in Energy Gels. Forms Gel Structure;Gelatin is used in Energy Gels as a thickening and stabilising agent, improving texture and consistency for easier consumption.. Evidence: Not Applicable;1;0
item_18;comp_4;Collagen (Type I, III): Active Ingredient in Energy Gels. Health or nutritional benefits;Collagen is used in Energy Gels as a functional protein ingredient, thought to support joint health and overall connective tissue maintenance.. Evidence: Moderate (99, 100);1;0
item_19;comp_4;Collagen (Type I, III): Active Ingredient in Protein Bars. Health or nutritional benefits;Collagen is added to Protein Bars as a protein source, where it is thought to support joint health and help maintain skin, hair, and nail condition.. Evidence: Moderate (99, 100);1;0
item_2;comp_3;Gelatin: Biding Agent in Gummies. Adds texture or viscosity;Gelatin is widely used in Gummies as a binding and gelling agent, providing their chewy texture and structural stability.. Evidence: Not Applicable;1;0
item_20;comp_3;Gelatin: Biding Agent in Photographic Film. Provides Coating;Gelatin is used in Photographic Film to form a light-sensitive and protective layer that holds photosensitive chemicals in place and preserves image detail.. Evidence: Not Applicable;1;0
item_21;comp_8;Surimi: Main Ingredient in Crab Sticks. Forms Base Texture;Surimi is the main ingredient in Crab Sticks, providing the base protein and characteristic texture that mimics crab meat.. Evidence: Not Applicable;1;0
item_22;comp_11;Calcium Carbonate (CaCO3): Active Ingredient in Antacids (Tums, Rolaids). Health or nutritional benefits;Calcium Carbonate is a long-established ingredient in OTC Antacids, widely used for its proven ability to neutralise stomach acid and provide relief from indigestion and heartburn.. Evidence: Substantial;1;0
item_23;comp_11;Calcium Carbonate (CaCO3): Main Ingredient in Calcium Supplements. Health or nutritional benefits;Calcium Carbonate is widely used in Calcium Supplements to support Bone Health, with strong evidence for improving Bone Density but limited to moderate evidence for preventing or treating Osteoporosis.. Evidence: Moderate (151, 152);1;0
item_24;comp_11;Calcium Carbonate (CaCO3): Abrasive in Toothpaste. Abrades or strip material from a surface;Calcium Carbonate is a common ingredient in Toothpaste, acting as a mild, effective abrasive and polishing agent to remove plaque and surface stains. Evidence: Substantial (153);1;0
